{
  "$schema": "https://json-schema.org/draft/2019-09/schema",
  "$id": "https://spectra.local/schemas/graph-quality-report/1.0.0",
  "title": "GraphQualityReport",
  "description": "graph-quality 命令 --json 输出结构的完整契约（Feature 217）。六项质量指标（duplicateCanonicalId / containsCoverage / orphanRatio / danglingEdges / legacyAndIgnoredNodes / freshness）+ 总体 verdict + next-step 建议。",
  "type": "object",
  "required": [
    "graphPath",
    "generatedAt",
    "schemaVersion",
    "duplicateCanonicalId",
    "containsCoverage",
    "orphanRatio",
    "danglingEdges",
    "legacyAndIgnoredNodes",
    "freshness",
    "overallVerdict",
    "nextSteps"
  ],
  "additionalProperties": false,
  "properties": {
    "graphPath": {
      "type": "string",
      "description": "被检测的 graph.json 绝对路径"
    },
    "generatedAt": {
      "type": "string",
      "format": "date-time",
      "description": "本次检测执行时刻（ISO 8601）"
    },
    "schemaVersion": {
      "type": "string",
      "description": "被检测图产物的 schemaVersion（cannot-assess 场景下可能为 'unknown'）"
    },
    "duplicateCanonicalId": {
      "type": "object",
      "required": ["status", "groups"],
      "additionalProperties": false,
      "properties": {
        "status": { "type": "string", "enum": ["pass", "fail"] },
        "groups": {
          "type": "array",
          "items": { "$ref": "#/$defs/DuplicateCanonicalIdGroup" }
        }
      }
    },
    "containsCoverage": {
      "type": "object",
      "required": ["status", "total", "covered", "ratio", "uncoveredIds"],
      "additionalProperties": false,
      "properties": {
        "status": { "$ref": "#/$defs/CheckStatus" },
        "total": { "type": "integer", "minimum": 0 },
        "covered": { "type": "integer", "minimum": 0 },
        "ratio": {
          "type": ["number", "null"],
          "minimum": 0,
          "maximum": 1
        },
        "uncoveredIds": {
          "type": "array",
          "items": { "type": "string" }
        }
      }
    },
    "orphanRatio": {
      "type": "object",
      "required": [
        "status",
        "totalSymbolNodes",
        "rawOrphanCount",
        "exemptedByCategory",
        "offendingRatio",
        "offendingIds",
        "allNodeZeroDegreeRatio"
      ],
      "additionalProperties": false,
      "properties": {
        "status": { "$ref": "#/$defs/CheckStatus" },
        "totalSymbolNodes": { "type": "integer", "minimum": 0 },
        "rawOrphanCount": { "type": "integer", "minimum": 0 },
        "exemptedByCategory": {
          "type": "object",
          "required": ["entrypoint", "pure-type", "test-export"],
          "additionalProperties": false,
          "properties": {
            "entrypoint": { "type": "integer", "minimum": 0 },
            "pure-type": { "type": "integer", "minimum": 0 },
            "test-export": { "type": "integer", "minimum": 0 }
          }
        },
        "offendingRatio": {
          "type": ["number", "null"],
          "minimum": 0,
          "maximum": 1
        },
        "offendingIds": {
          "type": "array",
          "items": { "type": "string" }
        },
        "allNodeZeroDegreeRatio": {
          "type": "number",
          "minimum": 0,
          "maximum": 1
        }
      }
    },
    "danglingEdges": {
      "type": "object",
      "required": ["status", "edges"],
      "additionalProperties": false,
      "properties": {
        "status": { "type": "string", "enum": ["pass", "fail"] },
        "edges": {
          "type": "array",
          "items": { "$ref": "#/$defs/DanglingEdgeRecord" }
        }
      }
    },
    "legacyAndIgnoredNodes": {
      "type": "object",
      "required": ["status", "legacyHashNodeIds", "ignoredPathNodeIds"],
      "additionalProperties": false,
      "properties": {
        "status": { "type": "string", "enum": ["pass", "fail"] },
        "legacyHashNodeIds": {
          "type": "array",
          "items": { "type": "string" }
        },
        "ignoredPathNodeIds": {
          "type": "array",
          "items": { "type": "string" }
        }
      }
    },
    "freshness": { "$ref": "#/$defs/GraphFreshnessVerdict" },
    "overallVerdict": {
      "type": "string",
      "enum": ["pass", "pass-with-warnings", "fail-strong-invariant", "cannot-assess"]
    },
    "cannotAssessReason": {
      "type": "string",
      "enum": [
        "graph-missing",
        "json-parse-error",
        "schema-too-old",
        "schema-newer-than-supported",
        "empty-graph",
        "no-symbol-nodes"
      ],
      "description": "overallVerdict==='cannot-assess' 时的具体原因分类（F266 追加 empty-graph：结构合法但 0 节点 0 边；no-symbol-nodes：节点非空但无任何 unifiedKind==='symbol' 节点，六项结构指标失去判定对象）"
    },
    "metricsPopulated": {
      "type": "boolean",
      "enum": [true],
      "description": "F266 E3：六项指标为真实测量值（而非 cannot-assess 的空态占位）。仅 no-symbol-nodes 的后置降级报告置 true；graph-missing / json-parse-error / schema-* / empty-graph 的占位报告不置。缺席即不保证为真实测量值，消费侧一律按占位处理。"
    },
    "nextSteps": {
      "type": "array",
      "items": { "type": "string" },
      "description": "面向维护者的下一步修复建议文本（SC-011）"
    }
  },
  "$defs": {
    "CheckStatus": {
      "type": "string",
      "enum": ["pass", "fail", "not-applicable"]
    },
    "DuplicateCanonicalIdGroup": {
      "type": "object",
      "required": ["filePath", "symbolName", "kind", "ids"],
      "additionalProperties": false,
      "properties": {
        "filePath": { "type": "string" },
        "symbolName": { "type": "string" },
        "kind": { "type": "string" },
        "ids": {
          "type": "array",
          "items": { "type": "string" }
        }
      }
    },
    "DanglingEdgeRecord": {
      "type": "object",
      "required": ["source", "target", "relation"],
      "additionalProperties": false,
      "properties": {
        "source": { "type": "string" },
        "target": { "type": "string" },
        "relation": { "type": "string" }
      }
    },
    "GraphFreshnessVerdict": {
      "type": "object",
      "required": ["state", "recordedSourceCommit", "currentHead"],
      "additionalProperties": false,
      "properties": {
        "state": {
          "type": "string",
          "enum": ["fresh", "dirty", "stale", "unknown-provenance"]
        },
        "recordedSourceCommit": {
          "type": ["string", "null"]
        },
        "currentHead": {
          "type": ["string", "null"]
        },
        "dirtyFiles": {
          "type": "array",
          "items": { "type": "string" }
        },
        "porcelainReadFailed": {
          "type": "boolean",
          "description": "FIX-3：git status --porcelain 读取失败时保守判 dirty 的标记"
        },
        "staleReasons": {
          "type": "array",
          "items": {
            "type": "string",
            "enum": [
              "source-commit",
              "source-tree-dirty-at-build",
              "collector-fingerprint",
              "collector-fingerprint-unrecorded",
              "collector-fingerprint-invalid"
            ]
          },
          "description": "F249（FR-009）：state==='stale' 时的判别原因数组，顺序确定性，多原因并存时全部保留。可选字段（state!=='stale' 时缺席），故不进 required；但因本 $defs 为 additionalProperties:false，必须显式登记于此，否则携带该字段的 --json 输出会被判非法。M11 卡 D 新增 source-tree-dirty-at-build（图采集自脏工作树而当前树已干净）"
        },
        "committedSourceChanges": {
          "type": "array",
          "items": { "type": "string" },
          "description": "M11 卡 D：staleReasons 含 source-commit 时，recordedSourceCommit 与 currentHead 两棵树之间有差异的采集面源码路径（排序去重）；range 无法解析或 sourceCommit 形态不合法时为空数组。其它情况字段缺席"
        },
        "builtFromDirtyTree": {
          "type": "boolean",
          "description": "M11 卡 D：图记录 sourceTreeDirty=true（采集自脏工作树）而当前树仍脏时为 true（state 仍为 dirty）；树干净后同一记录升格为 stale source-tree-dirty-at-build。其它情况字段缺席"
        }
      }
    }
  }
}
